Font Name,Description
teko,"Teko is an Open Source typeface that currently supports the Devanagari and Latin scripts. This font family has been created for use in headlines and other display-sized text on screen. Five font styles make up the initial release. 
 Display families with extensive character sets are rare for any script. With Indian typefaces, however, large character sets are even less common. ITF’s designs are an exception. The Teko typeface features letterforms with low stroke contrast, square proportions and a structure that appears visually simple. 
 The Regular, Medium and Semibold fonts are recommended for use in long headlines, while Bold is intended primarily for setting just one or two words. The Light is a beautiful variant that may be put to exceptionally good use in large headlines on websites. At display sizes, Teko works equally well on screen or in print. Each font contains 1090 glyphs, offering full support for the conjuncts and ligatures required by languages written with the Devanagari script. Teko is an excellent choice for use in advertising or for news tickers on television screens (breaking news, etc.) 
 Manushi Parikh designed the Teko typeface for the Indian Type Foundry, who published it in 2014. 
 In 2023, Marc Foley converted the family to a variable font. 
 To contribute, see  github.com/googlefonts/teko ."
questrial,"Questrial is the perfect font for body text and headlines on a website.
It's modern style, suited with past characteristics of great typefaces, make it highly readable in any context.
The full-circle curves on many characters make Questrial a great font to blend seamlessly with other fonts while still maintaining it's uniqueness.
 
 
It is heavily influenced by Swiss design, similar to a grotesk style which is closely found in Helvetica.
The numbers in Questrial are tabular figures so they can be used in tables and forms to enable maximum satisfaction.
 
 
Questrial language support includes African Latin and full coverage of Vietnamese, additional to all Western, Central, and South-Eastern European languages.
 
 
To contribute see  github.com/googlefonts/questrial"
jost,"Jost is an original font created by indestructible type*. It is inspired by 1920s German sans-serifs. This is version 3.7.

Jost is designed and maintained by Owen Earl, who is the creator of the font foundry indestructible type*.

in 2020 Owen Earl, and Mirko Velimirovic worked together to make Jost a variable font. 
 If you have questions or want to help out, please contribute at
 github.com/indestructible-type/Jost ."
indieflower,"This handwriting font feels carefree and open to me with the bubbly, rounded edges. It is easy to read and a bit bolder than some of my other fonts."
vibes,"Vibes is a typeface designed for Arabic, as well as English languages. It was designed to be a mixture that radiates energy, flexibility, and cuteness. It is specially designed to be used for title texts. Acknowledgements goes to Nadine Chahine, where this work wouldn't incepted without her help. 
 To contribute, see  github.com/bluemix/vibes-typeface ."
anton,"Anton is a reworking of a traditional advertising sans serif typeface. The
letter forms have been digitised and then reshaped for use as a webfont, the
counters have been opened up a little and the stems optimised for use as bold
display font in modern web browsers.
 
 
Anton language support includes now African Latin and full coverage of Vietnamese, additional to all Western, Central, and South-Eastern European languages.
 
  
To contribute see  github.com/googlefonts/AntonFont ."
volkhov,"Volkhov is a low-contrast seriffed typeface with a robust character, intended for providing a motivating reading experience.   As a four-weight family it is well-suited for complex text environments being economic and legible, contemporary and prominent. Many of its design solutions relate to this purpose: large open counters, rather short descenders, and brutal asymmetric serifs.   Spacing in Bold is slightly increased compared to the normal weight, because the bold mass is mostly grown inwards. The Italic has a steep angle and a distinctive calligraphically reminiscent character, as a counterpart to the rigorous Regular.   Designed by Ivan Petrov."
archivo,"Archivo is a grotesque sans serif typeface family originally designed for highlights and headlines. This family is reminiscent of late nineteenth century American typefaces. The technical and aesthetic characteristics of the font are both crafted for high performance typography. It was designed to be used simultaneously in print and online platforms and supports over 200 world languages. 
 Archivo has been upgraded to a variable font in 2021. The weight and width axes allow a wide variety of styles, from Thin to Black and from ExtraCondensed to Expanded. 
 Archivo is designed by Héctor Gatti and Omnibus-Type Team. To contribute to the project visit  github.com/Omnibus-Type ."
lexend,"Lexend fonts are intended to reduce visual stress and so improve reading performance. Initially they were designed with dyslexia and struggling readers in mind, but Bonnie Shaver-Troup, creator of the Lexend project, soon found out that these fonts are
    also great for everyone else.
 
 
    The first set of Lexend fonts by Thomas Jockin (
     Deca ,
     Exa ,
     Giga ,
     Mega ,
     Peta ,
     Tera ,
     Zetta ) becomes wider and more openly spaced (also known as ""tracked out""). This new version of Lexend is a variable font with a weight axis.
 
 
    Please note that the initial release of this font had a lighter Regular weight. It has been decided for the update of July 2021 to align the Regular weight with the one of Lexend Deca which is slightly bolder. Lexend and Lexend Deca are therefore the
    same (for now…). Ultimately this version will offer a HyperExpansion axis which will allow variation of inner and outer space of letterforms. 
 
    True to Bonnie’s vision, Lexend fonts are freely available for all since 2019 in Google Fonts.
 
 
    To contribute, see  github.com/googlefonts/lexend . For more information, see  lexend.com .
 
 
    To learn more, read  Clean and clear: making reading easier with Lexend (English),  Partnering to change how the world reads (English),
    and  Eine Partnerschaft mit dem Ziel, das Leseerlebnis weltweit zu verändern (Germany)."
kalam,"Kalam is a handwriting-style typeface supporting the Devanagari and Latin scripts.
This is an Open Source font family first published by the Indian Type Foundry in 2014.
 
 
Even though Kalam's letterforms derive from handwriting, the fonts have each been optimised for text on screen.
All in all, the typeface is a design that feels very personal.
Like many informal handwriting-style fonts, it appears rather fresh and new when seen on screen or printed on the page.
Kalam's letterforms feature a very steep slant from the top right to the bottom left.
They are similar to letters used in everyday handwriting, and look like they might have been written with either a thin felt-tip pen, or a ball-point pen.
In the Devanagari letterforms, the knotted-terminals are open, but some other counter forms are closed.
Features like these strengthen the feeling that text set in this typeface has been written very quickly, in a rapid manner.
 
 
Kalam is available in three weights: Light, Regular and Bold.
Each font contains 1,025 glyphs, which includes many unique Devanagari conjuncts.
These ensure full support for the major languages written with the Devanagari script.
The Latin component's character set is a basic western one, which enables typesetting in English and the other Western European languages.
Lipi Raval and Jonny Pinhorn developed the family for ITF; Raval designed the Devanagari component while she and Pinhorn worked together on the Latin.
 
 
The Kalam project is led by Indian Type Foundry, a type design foundry based in Ahmedabad, India. To contribute, see  github.com/itfoundry/kalam 
 
 
 Updated July 2015:  Updated to v2.001 with improved OpenType features."
signika,"Signika variable font is a sans-serif with a gentle character, developed for wayfinding, signage, and other media where clarity of information is required.
    It has a low contrast and tall x-height to improve readability of texts in small sizes as well as in large distances from the reader.
    Being a typical signage typeface it is inspired by typefaces such as Ronnia, Meta, and Tahoma.
 
 
    The typeface comes with a wide character set supporting Western European languages, Polish, and Czech.
    The figures are designed as tabular.
 
 
    In July 2023, a GRAD axis is added to solve the optical effects of negative text setting (dark color text on light background).
 
 
    To contribute, see  github.com/googlefonts/Signika"
yanonekaffeesatz,"""Yanone Kaffeesatz"" was first published in 2004 and is Yanone’s first ever finished typeface. Its
    Bold is
    reminiscent of 1920s coffee house typography, while the rather thin fonts bridge the gap to present times. Lacking
    self confidence and knowledge about the type scene, Yanone decided to publish the family for free under a  Creative Commons License . A decision that
    should turn out one of the best he ever made. It has been downloaded over 100,000 times to date, and you can witness
    Kaffeesatz use on German fresh-water gyms, Dubai mall promos and New Zealand McDonalds ads. And of course on coffee
    and foodstuff packaging and café design around the globe. 
 In 2009 he reworked much of the typeface and it got published in FontShop’s  FontFont Library  under the new name  FF Kava . You can read more about it in an extensive article by
    Yves Peters on  FontFeed . 
 Updated in December 2013 with Cyrillic, designed by Sol Matas and Juan Pablo del Peral at  Huerta Tipográfica . 
 To contribute, see  github.com/yanone/kaffeesatz ."
patuaone,Patua One is a slab serif text type designed for use in small sizes. It has low contrast and strong serifs and is intended to generate visual impact. Its thick serifs are curved to provide it with a touch of smoothness and gesture.
titilliumweb,"Titillium is born inside the Accademia di Belle Arti di Urbino as a
didactic project Course Type design of the Master of Visual Design Campi
Visivi. 
 The aim of the project is the creation of a collective fonts released under
OFL. Each academic year, a dozen students work on the project, developing it
further and solving problems. Any type designer interested in the amendment or
revision of Titillium is invited to co-operate with us, or develop their own
variants of the typeface according to the terms specified in the Open Font
license. We also ask all graphic designers who use Titillium in their projects
to  email us some examples 
of the typeface family in use, in order to prepare a case histories
database. 
 Three years after the birth of Titillium, the project is still evolving,
and even we don’t know what it will become in the future. 
 Special thanks go to: 
Prof. Luciano Perondi, design and curation 
Prof. Marcello Signorile, coordination 
Prof. Manuel Zanettin, web project supervision  
Diego Giusti, design of the first prototype"
arvo,"Arvo is a geometric slab-serif typeface family suited for screen and print. 
The family includes 4 cuts: Roman, Italic, Roman Bold, Bold Italic. 
It is a libre font, first published in Google Fonts. 
The flavour of the font is rather mixed. 
It's monolinear-ish, but has a tiny bit of contrast (which increases the legibility a little in Mac OS X.)
 
 
The name Arvo is a typical Estonian man's name, but is not widely used today. 
In the Finnish language, Arvo means ""number, value, worth."" Considering how much programming is involved in hinting, all these meanings are true.
 
 
In December 2013 Arvo 2.0.1 was released, with support for languages that use the Cyrillic script, the latin script is expanded to Adobe's  Glyph List 3, and many truetype hints are improved especially for in smaller sizes (regular cuts start now from 9ppem). 
Also added PANOSE classification numbers, cleaned up character palette order, and many more smaller bug fixes were made.
 
 
 Updated August 2015:  Bold and Bold Italic styles were updated to allow document embedding.
 
 
Arvo – это брусковый шрифт из семейства геометрических шрифтов с прямоугольными засечками. 
Данный шрифт создан для использования на экранах, а также в печатном виде (офсетная печать и т.д). 
Шрифт состоит из четырёх начертании: обычный, курсив, жирный и жирный курсив.Arvo распространяется на основании лицензии OFL. 
Благодаря которой любой пользователь может скачать/загрузить данное семейство шрифтов и пользоваться ими по своему усмотрению (смотри подробнее  scripts.sil.org/OFL ). 
Для улучения читаемости на экранах, шрифт имеет детальное оптимирование Truetype (хинтинг), что в системах Windows и Linux предоставляет возможность набора мелкого шрифта, не теряя при этом качества читаемости.

 
Краткая биография
 
 
Антон Коовит родился в 1981 году, в городе Таллинне. 
Изучал графический дизайн в Академии Художеств Эстонии, а также в ESAG городе Париже и в Амстердаме Академии Геррит Рейтвельда, Голландия. 
 
После окончания изучения графического дизайна Антон Коовит направился на учёбу в Королевскую Академию Художеств Гааги (КАВК den Haag) для приобетения  градуса магистра по шрифтовому дизайну. 
После окончания магистротурного обучения Антон Коовит основал фирму Кхорк ОО, которая действует по широкому профилю: оформление выстовок, логотипы, плакаты и шрифты. 
С 2007 года он проживает в Берлине. 
Кроме создания проектов в области типографии он преподаёт типографию, а также проводид консультативное обучение шрифтовому дизайну.
 
 
Известные шрифты Антона Коовита: Adam, Aleksei, GQ Slab, U8, Arvo."
hindmadurai,"Hind Madurai is a family of five Tamil fonts, which are part of the Indian Type Foundry’s larger Open Source Hind Multi-Script project. 
In addition to Tamil, the Hind Madurai fonts also include Latin-script characters.
 
 
Developed explicitly for use in User Interface design, Hind’s letterforms have a humanist-style construction, paired with seemingly monolinear strokes. 
Most of these strokes have flat endings: they either terminate with a horizontal or a vertical shear, rather than on a diagonal. 
This helps create clear-cut counter forms between the characters. 
Additionally, Hind’s letterforms feature open apertures and counterforms. 
The entire family feels very legible when used to set text.
 
 
The Tamil and Latin script components are scaled in relation to each other so that the head of the Tamil characters falls just below the Latin capital-height. 
Depending in the font weight, Tamil letters appear to be about 80–85% of the height of the Latin uppercase. 
Text set in the Tamil script sits nicely alongside the Latin’s lowercase, too. 
Although Hind Madurai is a “monolinear sans” face, much of its design features tends toward the traditional end of the design spectrum.
Each font in the Hind Madurai family has 552 glyphs, which includes all of the characters needed to write Tamil. 
The Latin character set is Adobe Latin 3, enabling typesetting for English and other Western European languages. 
 
 
Hind Madurai is a solid alternate when choosing typefaces for UI design, and a wise selection for electronic display embedding. 
Jyotish Sonowal designed Hind Madurai for ITF, who first published the fonts in 2015. 
Hind Madurai is named after Madurai, a city in Tamil Nadu, India.
 
 
The Hind Madurai project is led by Indian Type Foundry, a type design foundry based in Ahmedabad, India. 
To contribute, see  github.com/itfoundry/hind-madurai"
cormorant,"Cormorant is a free display type family developed by Christian Thalmann. The project currently comprises a total of 45 font files spanning 9 different visual styles (Roman, Italic, Infant, Infant Italic, Garamond, Garamond Italic, Upright Cursive, Small Caps, and Unicase) and 5 weights (Light, Regular, Medium, SemiBold, and Bold.) Cormorant was conceived, drawn, spaced, kerned, programmed, interpolated, and produced in its entirety by Christian Thalmann of Catharsis Fonts. For an illustrated presentation and description of the family, please visit its  Bēhance page . 
 While this project was heavily inspired by Claude Garamont's immortal legacy, Christian did not use any specific font as a starting point or direct reference for the designs. Most glyphs were drawn from scratch; when he needed guidance on a specific character, he searched for the term Garamond and skimmed through the results for a general impression. 
 He is grateful to the creative souls on the Typophile, TypeDrawers and Typografie forums, and Github, for a wealth of knowledge about type design, and for providing a large amount of excellent feedback on Cormorant during its development. He also thanks the tireless folks at Glyphs, in particular Rainer Erich Scheichelbauer of Schriftlabor and Georg Seifert. Special thanks go to Dave Crossland and Google Fonts for making the libre release of this font family possible through generous funding of the development process. 
 The Cormorant project is led by Christian Thalmann, a type designer based in Zurich, Switzerland. To contribute, see  github.com/CatharsisFonts/Cormorant"
teko,"Teko is an Open Source typeface that currently supports the Devanagari and Latin scripts. This font family has been created for use in headlines and other display-sized text on screen. Five font styles make up the initial release. 
 Display families with extensive character sets are rare for any script. With Indian typefaces, however, large character sets are even less common. ITF’s designs are an exception. The Teko typeface features letterforms with low stroke contrast, square proportions and a structure that appears visually simple. 
 The Regular, Medium and Semibold fonts are recommended for use in long headlines, while Bold is intended primarily for setting just one or two words. The Light is a beautiful variant that may be put to exceptionally good use in large headlines on websites. At display sizes, Teko works equally well on screen or in print. Each font contains 1090 glyphs, offering full support for the conjuncts and ligatures required by languages written with the Devanagari script. Teko is an excellent choice for use in advertising or for news tickers on television screens (breaking news, etc.) 
 Manushi Parikh designed the Teko typeface for the Indian Type Foundry, who published it in 2014. 
 In 2023, Marc Foley converted the family to a variable font. 
 To contribute, see  github.com/googlefonts/teko ."
archivo,"Archivo is a grotesque sans serif typeface family originally designed for highlights and headlines. This family is reminiscent of late nineteenth century American typefaces. The technical and aesthetic characteristics of the font are both crafted for high performance typography. It was designed to be used simultaneously in print and online platforms and supports over 200 world languages. 
 Archivo has been upgraded to a variable font in 2021. The weight and width axes allow a wide variety of styles, from Thin to Black and from ExtraCondensed to Expanded. 
 Archivo is designed by Héctor Gatti and Omnibus-Type Team. To contribute to the project visit  github.com/Omnibus-Type ."
spacegrotesk,"Space Grotesk is a proportional sans-serif typeface variant based on Colophon Foundry's fixed-width Space Mono family (2016). Originally designed by Florian Karsten in 2018, Space Grotesk retains the monospace's idiosyncratic details while optimizing for improved readability at non-display sizes.
 
 
 → floriankarsten.github.io/space-grotesk 
 
 
Space Grotesk includes Latin Vietnamese, Pinyin, and all Western, Central, and South-Eastern European language support, as well as several OpenType features (old-style and tabular figures, superscript and subscript numerals, fractions, stylistic alternates).
 
 
To contribute, see  github.com/floriankarsten/space-grotesk ."
varta,"Varta is a sans serif family that fuses warm humanity with bright clarity and professional crispness whos congenial personality emerges at larger sizes. 
 It is a variable font that has been designed to render well down to surprisingly small sizes and on both low and high-quality screens, which provides a broad range of utility. 
 Its features make it well suited to a variety of tasks, including sign systems, editorial design, packaging, and extended reading on screens. 
 To contribute, see  https://github.com/SorkinType/Varta 
 Varta is published by  Sorkin Type ."
sora,"Sora, meaning sky in Japanese, is a typeface family commissioned for the  Sora  decentralized autonomous economy focused on empowering projects that benefit society. Soramitsu, the developer of Sora, is a Japanese technology company specializing in blockchain development and well-known for creating the first central bank digital currency. 
 Sora typeface was designed to capture Soramitsu's spirit and heritage resulting in a type family with cues of low-resolution aesthetics and early screen typography but without nostalgia, as every decision was considered towards the crisp digital environment of today. The particularly big x-height combined with evidently generous counters turns the family into a convenient tool for app and web interfaces, where clarity and effectiveness at any size is an imperative. 
 To contribute, see  github.com/sora-xor/sora-font"
ibmplexsans,"IBM Plex® is the corporate typeface for IBM worldwide and an open-source project developed by the IBM Brand &
    Experience team (BX&D). Plex is an international typeface family designed to capture IBM’s brand spirit
    and history and to illustrate the unique relationship between mankind and machine—a principal theme for IBM since
    the turn of the century. The result is a neutral yet friendly Grotesque style typeface that balances design with the
    engineered details that make Plex distinctly IBM.  The
    family  includes a Sans, Sans Condensed, Mono, and Serif and has excellent legibility in print, web, and mobile
    interfaces.
 
 
    Plex’s three designs work well independently and even better together. Use the Sans as a
    contemporary compadre, the Serif for editorial storytelling, or the Mono to show code snippets. The unexpectedly
    expressive nature of the italics gives you even more options for your designs. Currently, IBM Plex Sans supports
    Extended Latin, Arabic, Cyrillic, Devanagari, Greek, Hebrew, Japanese, Korean and Thai."
ibmplexserif,"IBM Plex® is the corporate typeface for IBM worldwide and an open-source project developed by the IBM Brand &
    Experience team (BX&D). Plex is an international typeface family designed to capture IBM’s brand spirit
    and history and to illustrate the unique relationship between mankind and machine—a principal theme for IBM since
    the turn of the century. The result is a neutral yet friendly Grotesque style typeface that balances design with the
    engineered details that make Plex distinctly IBM.  The
    family  includes a Sans, Sans Condensed, Mono, and Serif and has excellent legibility in print, web, and mobile
    interfaces.
 
 
    Plex’s three designs work well independently and even better together. Use the Sans as a
    contemporary compadre, the Serif for editorial storytelling, or the Mono to show code snippets. The unexpectedly
    expressive nature of the italics gives you even more options for your designs. Currently, IBM Plex Sans supports
    Extended Latin, Arabic, Cyrillic, Devanagari, Greek, Hebrew, Japanese, Korean and Thai."
adamina,"Adamina is a typeface designed for text setting in small sizes. 
For this purpose the x-height is increased and contrast lowered. 
Proportions are transitional and compact. 
Refined design features like one-sided flaring and asymmetrical serifs are there to provide a pleasant reading experience.
 
 
Designed by Alexei Vanyashin for Cyreal.
 
 
To contribute to the project, visit  github.com/cyrealtype/Adamina 
 
 
 Updated:  January 2016 to Version 1.012, to correct GPOS table (enabling kerning.)"
barlow,"Barlow is a slightly rounded, low-contrast, grotesk type family.
Drawing from the visual style of the California public, Barlow shares qualities with the state's car plates, highway signs, busses, and trains.
 
 
This is the Normal family, which is part of the superfamily along with
 Semi Condensed  and
 Condensed ,
each with 9 weights in Roman and Italic.
 
 
 
The Barlow project is led by Jeremy Tribby, a designer based in San Francisco, USA.
To contribute, see  github.com/jpt/barlow"
